{
  "$schema": "http://json-schema.org/draft-07/schema#",
  "type": "array",
  "items": {
    "type": "object",
    "properties": {
      "id": { "type": "integer" },
      "name": { "type": "string" },
      "email": { "type": "string", "format": "email" },
      "age": { "type": "integer" },
      "city": { "type": "string" }
    },
    "required": ["id", "name", "email"]
  }
}