[
  {
    "id": 101,
    "name": "Vidhi Jain",
    "email": "vidhijain@gmail.com",
    "age": 21,
    "city": "Bhopal"
  },
  {
    "id": 102,
    "name": "Suhani Choudhary",
    "email": "choudharysuhani@gmail.com",
    "age": 21,
    "city": "Betul"
  },
  {
    "id": 103,
    "name": "Kapil Shreasth",
    "email": "kapilshreasth@gmail.com",
    "age": 20,
    "city": "india"
  }
]